{
  "version": "1.0",
  "language": "tr",
  "status": "limited-demo",
  "demonstrationLevel": "limited",
  "scope": "Limited Turkish demonstration for the declared English–Turkish cases.",
  "tokenizer": {
    "version": "1.0",
    "locale": "tr",
    "normalization": "NFC",
    "caseFold": "locale-lower",
    "segmentation": "unicode-whitespace-v1"
  },
  "packages": {
    "core": "core/concepts.json",
    "lexicon": "tr.json",
    "grammar": "grammar/tr.json",
    "morphology": null,
    "morphologyLexicon": null,
    "morphologyFeatures": null
  },
  "capabilities": {
    "parsing": true,
    "realization": true,
    "morphology": false,
    "questions": false,
    "frames": [
      "event.transfer_possession",
      "event.visual_perception"
    ],
    "directions": [
      "tr->en"
    ]
  },
  "audits": {
    "strictLexicon": {
      "enabled": false,
      "reason": "The Turkish lexicon is not yet on the strict lexical model."
    },
    "morphology": {
      "enabled": false,
      "legacyInflections": false,
      "reason": "No Turkish morphology package is declared."
    }
  }
}
