{
  "version": "1.0",
  "language": "it",
  "status": "limited-demo",
  "demonstrationLevel": "limited",
  "scope": "Limited Italian demonstration for the declared English–Italian cases.",
  "tokenizer": {
    "version": "1.0",
    "locale": "it",
    "normalization": "NFC",
    "caseFold": "locale-lower",
    "segmentation": "unicode-whitespace-v1"
  },
  "packages": {
    "core": "concepts.json",
    "lexicon": "it.json",
    "grammar": "grammar/it.json",
    "morphology": null,
    "morphologyLexicon": null,
    "morphologyFeatures": null
  },
  "capabilities": {
    "parsing": true,
    "realization": true,
    "morphology": false,
    "questions": false,
    "frames": [
      "event.visual_perception"
    ],
    "directions": [
      "it->en"
    ]
  },
  "audits": {
    "strictLexicon": {
      "enabled": true,
      "reason": null
    },
    "morphology": {
      "enabled": false,
      "legacyInflections": false,
      "reason": "No Italian morphology package is declared."
    }
  }
}
