{
  "version": "1.0",
  "language": "ar",
  "status": "morphology-only",
  "demonstrationLevel": "structural",
  "scope": "Arabic morphology package for structural morphology checks only; no sentence parsing or realization.",
  "tokenizer": {
    "version": "1.0",
    "locale": "ar",
    "normalization": "NFC",
    "caseFold": "locale-lower",
    "segmentation": "unicode-whitespace-v1"
  },
  "packages": {
    "core": "concepts.json",
    "lexicon": null,
    "grammar": null,
    "morphology": "morphology/ar.json",
    "morphologyLexicon": "morphology/ar-lexicon.json",
    "morphologyFeatures": "morphology/features.json"
  },
  "capabilities": {
    "parsing": false,
    "realization": false,
    "morphology": true,
    "questions": false,
    "frames": [],
    "directions": []
  },
  "audits": {
    "strictLexicon": {
      "enabled": false,
      "reason": "No sentence lexicon package is declared; the morphology stress lexicon is not a sentence lexicon."
    },
    "morphology": {
      "enabled": true,
      "legacyInflections": false,
      "reason": null
    }
  }
}
