{
  "version": "1.0",
  "language": "pl",
  "status": "controlled-subset",
  "demonstrationLevel": "controlled",
  "scope": "Controlled Polish parsing and realization for the declared English–Polish subset.",
  "tokenizer": {
    "version": "1.0",
    "locale": "pl",
    "normalization": "NFC",
    "caseFold": "locale-lower",
    "segmentation": "unicode-whitespace-v1"
  },
  "packages": {
    "core": "core/concepts.json",
    "lexicon": "pl.json",
    "grammar": "grammar/pl.json",
    "morphology": "morphology/pl.json",
    "morphologyLexicon": "pl.json",
    "morphologyFeatures": "morphology/features.json"
  },
  "capabilities": {
    "parsing": true,
    "realization": true,
    "morphology": true,
    "questions": true,
    "frames": [
      "event.auditory_attention",
      "event.break_object",
      "event.cost",
      "event.desire",
      "event.drink",
      "event.eat",
      "event.help",
      "event.learn",
      "event.liking",
      "event.movement",
      "event.movement.to_destination",
      "event.open",
      "event.preference",
      "event.purchase",
      "event.raise_object",
      "event.read",
      "event.search",
      "event.sleep",
      "event.social_icebreak",
      "event.transfer_possession",
      "event.visual_attention",
      "event.visual_perception",
      "event.wait_for_entity",
      "event.work",
      "event.write",
      "state.classification",
      "state.existence",
      "state.location",
      "state.possession",
      "state.predication"
    ],
    "directions": [
      "pl->en"
    ]
  },
  "audits": {
    "strictLexicon": {
      "enabled": true,
      "reason": null
    },
    "morphology": {
      "enabled": true,
      "legacyInflections": true,
      "reason": null
    }
  }
}
